{
  "dogName": "奶茶",
  "age": "5 岁",
  "breed": "比熊",
  "weight": "9kg",
  "size": "small",
  "bodyCondition": "slightly_fat",
  "foodTypes": ["kibble", "mixed"],
  "snackLevel": "high",
  "movement": {
    "outdoorFrequency": "two_to_three",
    "dailyMinutes": "around_30",
    "sniffing": "normal"
  },
  "recentSignals": ["normal"],
  "homeEnvironment": ["none"],
  "mentalState": { "positiveEngagement": "often", "relaxation": "easy", "socialConnection": "secure", "distressSignals": ["none"] }
}
